{
  "schemaVersion": 1,
  "contractVersion": 1,
  "evaluationKind": "html-dom-v1",
  "languageId": "html",
  "title": "HTML Code Quest",
  "quests": [
    {
      "id": "quest-html-document-structure",
      "slug": "document-structure",
      "revision": 1,
      "order": 1,
      "lessonId": "html-01-document-structure",
      "conceptIds": [
        "html.document-structure",
        "html.semantics",
        "html.heading-structure"
      ],
      "difficulty": "beginner",
      "estimatedMinutes": 20,
      "title": "의미 있는 학습 기록 구조",
      "summary": "학습 기록을 header, nav, main, section으로 나누고 제목 구조를 세웁니다.",
      "instructions": "아래 시작 코드를 수정해 HTML 문서 선언과 학습 기록의 의미 구조를 완성하세요. 첫 줄에 HTML5 문서 형식 선언을 작성하고, header 안에는 학습 목차를 설명하는 nav를 둡니다. main은 한 개만 사용하며 첫 제목은 ‘HTML 학습 기록’인 h1으로 작성하고 서로 다른 주제를 담는 section 두 개를 배치하세요.",
      "starterCode": "<header>\n  <p>BAM.dev</p>\n  <nav>\n    <a href=\"#overview\">개요</a>\n  </nav>\n</header>\n\n<main>\n  <h2>HTML 학습 기록</h2>\n  <section id=\"overview\">\n    <h2>오늘의 개념</h2>\n  </section>\n</main>",
      "requirements": [
        "첫 줄에 <!doctype html> 문서 형식 선언을 작성합니다.",
        "콘텐츠의 머리말을 header 요소로 작성합니다.",
        "header 안에 aria-label이 ‘학습 목차’인 nav 요소를 작성합니다.",
        "주요 콘텐츠를 담는 main 요소를 정확히 한 개 사용합니다.",
        "main의 직접 자식 h1에 ‘HTML 학습 기록’을 포함합니다.",
        "main의 직접 자식으로 section 요소를 정확히 두 개 작성합니다."
      ],
      "examples": [
        {
          "source": "<!doctype html>\n<main><h1>HTML 학습 기록</h1><section><h2>개념</h2></section><section><h2>실습</h2></section></main>",
          "explanation": "HTML 문서 형식을 선언한 뒤 한 문서의 핵심 제목은 h1로 표현하고, 성격이 다른 두 주제를 section으로 나눌 수 있습니다."
        }
      ],
      "publicTests": [
        {
          "id": "html-structure-doctype-present",
          "label": "HTML 문서 형식 선언이 있다",
          "assertion": {
            "kind": "doctype-present"
          }
        },
        {
          "id": "html-structure-header-exists",
          "label": "header 요소가 있다",
          "assertion": {
            "kind": "selector-exists",
            "selector": "header"
          }
        },
        {
          "id": "html-structure-labelled-nav",
          "label": "학습 목차 nav가 있다",
          "assertion": {
            "kind": "selector-exists",
            "selector": "header > nav[aria-label=\"학습 목차\"]"
          }
        },
        {
          "id": "html-structure-single-main",
          "label": "main 요소가 한 개다",
          "assertion": {
            "kind": "selector-count",
            "selector": "main",
            "expected": 1
          }
        },
        {
          "id": "html-structure-primary-heading",
          "label": "h1이 학습 기록 제목을 설명한다",
          "assertion": {
            "kind": "text-includes",
            "selector": "main > h1",
            "expected": "HTML 학습 기록"
          }
        },
        {
          "id": "html-structure-two-sections",
          "label": "main에 section이 두 개다",
          "assertion": {
            "kind": "selector-count",
            "selector": "main > section",
            "expected": 2
          }
        }
      ],
      "failureExplanations": [
        {
          "testId": "html-structure-doctype-present",
          "message": "문서의 첫 줄에 <!doctype html>을 작성해 HTML 문서 형식을 선언하세요."
        },
        {
          "testId": "html-structure-header-exists",
          "message": "페이지 머리말 역할의 콘텐츠를 div가 아닌 header로 묶었는지 확인하세요."
        },
        {
          "testId": "html-structure-labelled-nav",
          "message": "nav가 header의 직접 자식인지, aria-label 값이 정확히 ‘학습 목차’인지 확인하세요."
        },
        {
          "testId": "html-structure-single-main",
          "message": "페이지의 핵심 콘텐츠를 나타내는 main은 정확히 한 개여야 합니다."
        },
        {
          "testId": "html-structure-primary-heading",
          "message": "main 바로 아래 h1을 만들고 제목에 ‘HTML 학습 기록’을 포함하세요."
        },
        {
          "testId": "html-structure-two-sections",
          "message": "main 바로 아래에 서로 다른 주제를 담는 section 두 개를 작성하세요."
        }
      ],
      "hints": [
        {
          "level": 1,
          "stage": "concept",
          "title": "콘텐츠 역할부터 나누기",
          "content": "<!doctype html>은 브라우저가 표준 모드로 HTML 문서를 해석하게 합니다. header는 머리말, nav는 주요 이동, main은 핵심 콘텐츠, section은 제목이 있는 주제 묶음을 표현합니다."
        },
        {
          "level": 2,
          "stage": "observation",
          "title": "현재 요소의 관계 살펴보기",
          "content": "첫 줄에 문서 형식 선언이 있는지 본 뒤 nav가 header 안에 있는지, main 아래 제목 수준이 h1인지, section 개수가 몇 개인지 차례로 확인하세요."
        },
        {
          "level": 3,
          "stage": "implementation",
          "title": "작은 구조부터 고치기",
          "content": "첫 줄에 <!doctype html>을 작성하세요. nav에 aria-label을 추가하고 h2를 h1으로 바꾼 다음, main 안에 두 번째 section을 추가하세요."
        }
      ],
      "commonMistakes": [
        {
          "id": "html-structure-div-only",
          "title": "모든 영역을 div로 작성함",
          "explanation": "모양은 비슷해 보여도 콘텐츠 역할이 드러나지 않습니다. 먼저 역할을 설명하는 네이티브 요소가 있는지 확인하세요."
        },
        {
          "id": "html-structure-heading-skip",
          "title": "첫 제목을 h2로 시작함",
          "explanation": "시각적 크기보다 문서의 제목 계층을 기준으로 제목 수준을 선택해야 합니다."
        }
      ]
    },
    {
      "id": "quest-html-descriptive-navigation",
      "slug": "descriptive-navigation",
      "revision": 1,
      "order": 2,
      "lessonId": "html-02-text-links",
      "conceptIds": [
        "html.hyperlinks",
        "html.urls"
      ],
      "difficulty": "beginner",
      "estimatedMinutes": 20,
      "title": "목적이 분명한 문서 내비게이션",
      "summary": "문서 조각 URL과 설명적인 링크 문구를 연결해 예측 가능한 목차를 만듭니다.",
      "instructions": "세 개의 연습 주제로 이동하는 문서 내부 내비게이션을 완성하세요. nav의 이름을 제공하고 각 링크의 href가 대상 section의 id와 연결되게 작성합니다. 폼 주제 링크는 ‘접근 가능한 폼 연습’이라는 목적을 링크 문구만으로 알 수 있어야 합니다.",
      "starterCode": "<nav>\n  <a data-link=\"structure\" href=\"#structure\">구조</a>\n  <a data-link=\"forms\" href=\"#contact\">폼 보기</a>\n</nav>\n\n<section id=\"structure\">\n  <h2>문서 구조</h2>\n</section>\n<section id=\"forms\">\n  <h2>폼</h2>\n</section>",
      "requirements": [
        "aria-label이 ‘연습 주제’인 nav 요소를 작성합니다.",
        "nav의 직접 자식 링크를 정확히 세 개 작성합니다.",
        "data-link가 structure인 링크의 href를 #structure로 설정합니다.",
        "data-link가 forms인 링크의 href를 #forms로 설정합니다.",
        "폼 링크 문구에 ‘접근 가능한 폼 연습’을 포함합니다.",
        "폼 링크의 목적지인 id가 forms인 section을 작성합니다."
      ],
      "examples": [
        {
          "source": "<nav aria-label=\"연습 주제\"><a href=\"#links\">설명적인 링크 연습</a></nav><section id=\"links\"><h2>링크</h2></section>",
          "explanation": "문서 조각 URL의 #links와 목적지의 id를 같게 하고 링크 문구로 이동 목적을 설명했습니다."
        }
      ],
      "publicTests": [
        {
          "id": "html-navigation-labelled-nav",
          "label": "연습 주제 nav가 있다",
          "assertion": {
            "kind": "selector-exists",
            "selector": "nav[aria-label=\"연습 주제\"]"
          }
        },
        {
          "id": "html-navigation-three-links",
          "label": "nav 링크가 세 개다",
          "assertion": {
            "kind": "selector-count",
            "selector": "nav > a",
            "expected": 3
          }
        },
        {
          "id": "html-navigation-structure-target",
          "label": "구조 링크가 #structure를 가리킨다",
          "assertion": {
            "kind": "attribute-equals",
            "selector": "a[data-link=\"structure\"]",
            "attribute": "href",
            "expected": "#structure"
          }
        },
        {
          "id": "html-navigation-forms-target",
          "label": "폼 링크가 #forms를 가리킨다",
          "assertion": {
            "kind": "attribute-equals",
            "selector": "a[data-link=\"forms\"]",
            "attribute": "href",
            "expected": "#forms"
          }
        },
        {
          "id": "html-navigation-descriptive-form-text",
          "label": "폼 링크 문구가 목적을 설명한다",
          "assertion": {
            "kind": "text-includes",
            "selector": "a[data-link=\"forms\"]",
            "expected": "접근 가능한 폼 연습"
          }
        },
        {
          "id": "html-navigation-forms-section",
          "label": "forms 목적지 section이 있다",
          "assertion": {
            "kind": "selector-exists",
            "selector": "section#forms"
          }
        }
      ],
      "failureExplanations": [
        {
          "testId": "html-navigation-labelled-nav",
          "message": "nav에 aria-label=\"연습 주제\"를 추가해 이 내비게이션의 목적을 설명하세요."
        },
        {
          "testId": "html-navigation-three-links",
          "message": "nav 바로 아래에 구조, 링크, 폼으로 이동하는 a 요소 세 개가 필요합니다."
        },
        {
          "testId": "html-navigation-structure-target",
          "message": "data-link=\"structure\"인 링크의 href가 #structure인지 확인하세요."
        },
        {
          "testId": "html-navigation-forms-target",
          "message": "data-link=\"forms\"인 링크의 href와 목적지 section의 id를 forms로 맞추세요."
        },
        {
          "testId": "html-navigation-descriptive-form-text",
          "message": "‘보기’처럼 맥락이 필요한 말 대신 ‘접근 가능한 폼 연습’이 포함된 링크 문구를 작성하세요."
        },
        {
          "testId": "html-navigation-forms-section",
          "message": "href=\"#forms\"가 이동할 수 있도록 id=\"forms\"인 section을 작성하세요."
        }
      ],
      "hints": [
        {
          "level": 1,
          "stage": "concept",
          "title": "href와 id의 연결",
          "content": "href가 #이름인 링크는 같은 문서에서 id가 이름인 요소를 목적지로 삼습니다. 링크 문구는 주변 문장 없이도 목적을 설명해야 합니다."
        },
        {
          "level": 2,
          "stage": "observation",
          "title": "링크와 목적지를 짝지어 보기",
          "content": "각 a의 href에서 # 뒤 값을 읽고 같은 값을 가진 section id가 있는지 확인하세요. nav의 링크 개수와 aria-label도 살펴보세요."
        },
        {
          "level": 3,
          "stage": "implementation",
          "title": "세 쌍을 완성하기",
          "content": "#structure, #links, #forms 링크를 만들고 대응하는 section id를 작성한 뒤, 폼 링크 문구를 구체적으로 바꾸세요."
        }
      ],
      "commonMistakes": [
        {
          "id": "html-navigation-generic-link-text",
          "title": "모든 링크를 ‘보기’로 작성함",